{
  "$schema": "http://json-schema.org/draft-04/schema#",
  "id": "http://justice.gov.uk/stagingbulkscan/command/stagingbulkscan.command.update-scan-document-status.json",
  "type": "object",
  "properties": {
    "id": {
      "$ref": "http://justice.gov.uk/core/courts/courtsDefinitions.json#/definitions/uuid"
    },
    "scanDocumentId": {
      "$ref": "http://justice.gov.uk/core/courts/courtsDefinitions.json#/definitions/uuid"
    },
    "scanEnvelopeId": {
      "$ref": "http://justice.gov.uk/core/courts/courtsDefinitions.json#/definitions/uuid"
    },
    "email": {
      "type": "string"
    },
    "caseId": {
      "$ref": "http://justice.gov.uk/core/courts/courtsDefinitions.json#/definitions/uuid"
    },
    "title": {
      "$ref": "http://justice.gov.uk/stagingbulkscan/domain/title.json"
    },
    "firstName": {
      "type": "string",
      "minLength": 1,
      "maxLength": 255
    },
    "lastName": {
      "type": "string",
      "minLength": 1,
      "maxLength": 255
    },
    "dateOfBirth": {
      "type": "string"
    },
    "gender": {
      "$ref": "http://justice.gov.uk/stagingbulkscan/domain/gender.json"
    },
    "address": {
      "$ref": "http://justice.gov.uk/stagingbulkscan/domain/address.json"
    },
    "contactNumber": {
      "$ref": "http://justice.gov.uk/stagingbulkscan/domain/contact-details.json"
    },
    "nationalInsuranceNumber": {
      "type": "string"
    }
  },
  "required": [
    "scanEnvelopeId",
    "scanDocumentId"
  ]
}